<?xml version="1.0" encoding="UTF-8" ?>
<processo xmlns:xsi="http://www.w3.org/2001/XMLSchema-instance"
	xsi:noNamespaceSchemaLocation="processo.xsd" nome="findAPIById"
	inicio="SearchAPIsListCommand">
	

    <sequencia executa="SearchAPIsListCommand" proximo="SelectAPIFromAPIListCommand"/>
    <sequencia executa="SelectAPIFromAPIListCommand" >
    <resultado tipo="true" proximo="SearchAPIVersionCommand"/>
        <resultado tipo="false">
            <excecao tipo="COMMAND" construcao="MN000" />
        </resultado>
     </sequencia>
     <sequencia executa="SearchAPIVersionCommand" proximo="SearchAPIVersionDocumentationCommand"/>
 	<sequencia executa="SearchAPIVersionDocumentationCommand" proximo="BuildJSONReturnCommand"/>
 	<sequencia executa="BuildJSONReturnCommand"/>
</processo>